{
  "contractVersion": "2.0",
  "kind": "execution_plan",
  "id": "execution_plan_1",
  "workPlan": { "kind": "work_plan", "id": "work_plan_1", "version": "2.0" },
  "assignments": [{ "role": "Builder", "model": "model_local_1", "workers": 1 }],
  "budget": { "maxCalls": 10 },
  "concurrency": 1,
  "placement": ["node_local"],
  "constraints": ["local_only"]
}
